{
  "$schema": "https://json-schema.org/draft/2019-09/schema",
  "$id": "https://github.com/bitol-io/open-observability-results-standard/blob/main/schema/oors-json-schema-v0.1.0.json",
  "title": "Open Observability Results Standard (OORS)",
  "description": "A lightweight, tool-agnostic format to exchange data quality and data observability results.",
  "type": "object",
  "additionalProperties": false,
  "required": ["apiVersion", "kind", "id", "observedAt", "source", "results"],
  "properties": {
    "apiVersion": {
      "type": "string",
      "default": "v0.1.0",
      "description": "Version of the OORS schema used. Indicates the version of the standard, e.g., `v0.1.0`."
    },
    "kind": {
      "type": "string",
      "const": "ObservabilityResults",
      "description": "The type of OORS object. For OORS, always `ObservabilityResults`."
    },
    "id": {
      "type": "string",
      "description": "A unique identifier (could be a UUID) identifying the specific observability results."
    },
    "observedAt": {
      "type": "string",
      "format": "date-time",
      "description": "The moment in time when the observations were done (ISO 8601 format)."
    },
    "source": {
      "type": "object",
      "additionalProperties": false,
      "description": "Object describing the source from where the results come (e.g., job, pipeline, etc.).",
      "required": ["process"],
      "properties": {
        "process": {
          "type": "string",
          "description": "The name of the process (job, pipeline, etc.) that made the observations."
        },
        "runID": {
          "type": "string",
          "description": "An optional unique identifier for the specific run/execution of the process (e.g., build ID, run ID, etc.)."
        },
        "vendor": {
          "type": "string",
          "description": "An optional field indicating the vendor or tool that produced the observations (e.g., `soda`, `dbt`, `inhouse-build`, etc.)."
        }
      }
    },
    "contract": {
      "type": "object",
      "additionalProperties": false,
      "description": "Object describing the contract that provided the specifications for the observations. Optional but highly recommended for traceability and context. When provided, all observations in `results` are expected to be based on the specifications defined in that contract.",
      "properties": {
        "contractID": {
          "type": "string",
          "description": "A unique identifier (could be a UUID) identifying the specific contract (ODCS/ODPS) that provided the specifications for the observations."
        },
        "standard": {
          "type": "string",
          "description": "The standard followed by the contract, e.g., `ODCS`, `ODPS`, etc."
        },
        "version": {
          "type": "string",
          "description": "The version of the contract (not the standard), e.g., `1.0.0`, `2.0.0`, etc."
        }
      }
    },
    "results": {
      "type": "array",
      "minItems": 1,
      "description": "An array of results (at least one). Each result object carries the details of a specific observation (check or metric).",
      "items": {
        "$ref": "#/$defs/Result"
      }
    }
  },
  "$defs": {
    "Result": {
      "type": "object",
      "additionalProperties": false,
      "description": "A single result object carrying the details of a specific observation.",
      "required": ["id", "type", "name", "status"],
      "properties": {
        "id": {
          "type": "string",
          "description": "A unique identifier for the specific check/metric."
        },
        "type": {
          "type": "string",
          "enum": ["check", "metric"],
          "description": "The type of observation: `check` (for pass/fail checks) or `metric` (for measured values)."
        },
        "name": {
          "type": "string",
          "description": "A human-readable name for the check/metric."
        },
        "status": {
          "type": "string",
          "enum": ["pass", "fail"],
          "description": "The outcome of the observation: `pass` or `fail`."
        },
        "severity": {
          "type": "string",
          "description": "The severity level of the observation, e.g., `critical`, `high`, `medium`, `low`, `warning`, etc."
        },
        "dimension": {
          "type": "string",
          "description": "The dimension of data quality being observed, e.g., `accuracy`, `completeness`, `consistency`, `timeliness`, `validity`, `uniqueness`, etc. (following ODCS data quality dimensions)."
        },
        "target": {
          "type": "object",
          "additionalProperties": false,
          "description": "Object describing the resource being observed.",
          "properties": {
            "resourceType": {
              "type": "string",
              "description": "The type of resource, e.g., `table`, `column`, `dataset`, etc."
            },
            "resourceIdentifier": {
              "type": ["string", "array"],
              "items": {
                "type": "string"
              },
              "description": "The identifier(s) of the resource, e.g., table name, column name, etc. May be a single string or an array of strings."
            }
          }
        },
        "measure": {
          "type": "object",
          "additionalProperties": false,
          "description": "Object describing the measurement details.",
          "properties": {
            "metric": {
              "type": "string",
              "description": "The name of the metric being measured, e.g., `rowCount`, `age`, `latency`, etc."
            },
            "value": {
              "type": ["number", "string"],
              "description": "The observed value of the metric."
            },
            "threshold": {
              "type": "object",
              "description": "Object describing the threshold criteria, e.g., `mustBe`, `mustBeLowerOrEqual`, etc. (following ODCS operator definitions)."
            },
            "unit": {
              "type": "string",
              "description": "The unit of measurement, e.g., `rows`, `seconds`, `percent`, etc."
            }
          }
        },
        "message": {
          "type": "string",
          "description": "A human-readable message providing additional context about the observation."
        }
      }
    }
  }
}
