{
  "apiVersion": "v0.2.1",
  "kind": "ObservabilityResults",
  "id": "9f1c8a52-2b4e-4a6e-9d3e-7c2a1f0b4d11",
  "observedAt": "2026-01-15T09:30:00Z",
  "source": {
    "process": "nightly-quality-suite"
  },
  "results": [
    {
      "id": "no_dup_rows",
      "type": "check",
      "name": "No duplicate rows",
      "status": "pass"
    }
  ]
}
